
Öffentliche Stellen sind gemäß der Richtlinie (EU) 2016/2102 des Europäischen Parlaments dazu verpflichtet, Webauftritte barrierefrei zugänglich zu machen.;Die Stadt München ist eine öffentliche Stelle.\nDie Stadt München muss sich an die Regeln halten.\nDie Stadt München muss ihre Internet-Seiten barriere-frei machen.
Die Stadt München arbeitet beständig an der Verbesserung ihres Webauftritts und konnte aufgrund der Fülle des Materials und der Komplexität der Site noch nicht alle Inhalte und Services digital barrierefrei gestalten.;Die Stadt München arbeitet immer weiter daran.\nDie Internet-Seite soll noch weniger Barrieren haben.
Sie können Mängel bei der Einhaltung der Anforderungen an die Barrierefreiheit mitteilen oder Informationen, die nicht barrierefrei dargestellt werden müssen, barrierefrei anfordern.;Sie können uns sagen,\nwenn Sie Barrieren auf der Internet-Seite finden.\nZum Beispiel:\nSie können ein Dokument nicht lesen.\nDas Dokument ist ein PDF-Dokument.\nPDF-Dokumente kann man nicht verändern.\nDafür sehen sie auf jedem Computer gleich aus.\nSie können uns sagen,\nwenn Sie ein Dokument nicht lesen können.\nDann machen wir das Dokument barriere-frei.\nDas heißt:\nWir machen das Dokument so um,\ndass Sie es mit einem Vorlese-Programm lesen können.\nEin Vorlese-Programm ist ein Computer-Programm.\nDas Programm liest Ihnen den Text vor.\nSie können uns sagen,\nwenn Sie ein Dokument nicht lesen können.\nDann machen wir das Dokument barriere-frei.\nDas heißt:\nWir machen das Dokument so um,\ndass Sie es mit einem Vorlese-Programm lesen können.\nEin Vorlese-Programm ist ein Computer-Programm.\nDas Programm liest Ihnen den Text vor.\nSie können uns sagen,\nwenn Sie ein Dokument nicht lesen können.\nDann machen wir das Dokument barriere-frei.\nDas heißt:\nWir machen das Dokument so um,\ndass Sie es mit einem Vorlese-Programm lesen können.\nEin Vorlese-Programm ist ein Computer-Programm.\nDas Programm liest Ihnen den Text vor.\nSie können uns sagen,\nwenn Sie ein Dokument nicht lesen können.\nDann machen wir das Dokument barriere-frei.\nDas heißt:\nWir machen das Dokument so um,\ndass Sie es mit einem Vorlese-Programm lesen können.\nEin Vorlese-Programm ist ein Computer-Programm.\nDas Programm liest Ihnen den Text vor.\nSie können uns sagen,\nwenn Sie ein Dokument nicht lesen können.\nDann machen wir das Dokument barriere-frei.\nDas heißt:\nWir machen das Dokument so um,\ndass Sie es mit einem Vorlese-Programm lesen können.\nEin Vorlese-Programm ist ein Computer-Programm.\nDas Programm liest Ihnen den Text vor.\nSie können uns sagen,\nwenn Sie ein Dokument nicht lesen können.\nDann machen wir das Dokument barriere-frei.\nDas heißt:\nWir machen das Dokument so um,\ndass Sie es mit einem Vorlese-Programm lesen können.\nEin Vorlese-Programm ist ein Computer-Programm.\nDas Programm liest Ihnen den Text vor.\nSie können uns sagen,\nwenn Sie ein Dokument nicht lesen können.\nDann machen wir das Dokument barriere-frei.\nDas heißt:\nWir machen das Dokument so um,\ndass Sie es mit einem Vorlese-Programm lesen können.\nEin Vorlese-Programm ist ein Computer-Programm.\nDas Programm liest Ihnen den Text vor.\nSie können uns sagen,\nwenn Sie ein Dokument nicht lesen können.\nDann machen wir das Dokument barriere-frei.\nDas heißt:\nWir machen das Dokument so um,\ndass Sie es mit einem Vorlese-Programm lesen können.\nEin Vorlese-Programm ist ein Computer-Programm.\nDas Programm liest Ihnen den Text vor.\nSie können uns sagen,\nwenn Sie ein Dokument nicht lesen können.\nDann machen wir das Dokument barriere-frei.\nDas heißt:\nWir machen das Dokument so um,\ndass Sie es mit einem Vorlese-Programm lesen können.\nEin Vorlese-Programm ist ein Computer-Programm.\nDas Programm liest Ihnen den Text vor.\nSie können uns sagen,\nwenn Sie ein Dokument nicht lesen können.\nDann machen wir das Dokument barriere-frei.\nDas heißt:\nWir machen das Dokument so um,\ndass Sie es mit einem Vorlese-Programm lesen können.\nEin Vorlese-Programm ist ein Computer-Programm.\nDas Programm liest Ihnen den Text vor.\nSie können uns sagen,\nwenn Sie ein Dokument nicht lesen können.\nDann machen wir das Dokument barriere-frei.\nDas heißt:\nWir machen das Dokument so um,\ndass Sie es mit einem Vorlese-Programm lesen können.\nEin Vorlese-Programm ist ein Computer-Programm.\nDas Programm liest Ihnen den Text vor.\nSie können uns sagen,\nwenn Sie ein Dokument nicht lesen können.\nDann machen wir das Dokument barriere-frei.\nDas heißt:\nWir machen das Dokument so um,\ndass Sie es mit einem Vorlese-Programm lesen können.\nEin Vorlese-Programm ist ein Computer-Programm.\nDas Programm liest Ihnen den Text vor.\nSie können uns sagen,\nwenn Sie ein Dokument nicht lesen können.\nDann machen wir das Dokument barriere-frei.\nDas heißt:\nWir machen das Dokument so um,\ndass Sie es mit einem Vorlese-Programm lesen können.\nEin Vorlese-Programm ist ein Computer-Programm.\nDas Programm liest Ihnen den Text vor.\nSie können uns sagen,\nwenn Sie ein Dokument nicht lesen können.\nDann machen wir das Dokument barriere-frei.\nDas heißt:\nWir machen das Dokument so um,\ndass Sie es mit einem Vorlese-Programm lesen können.\nEin Vorlese-Programm ist ein Computer-Programm.\nDas Programm liest Ihnen den Text vor.\nSie können uns sagen,\nwenn Sie ein Dokument nicht lesen können.\nDann machen wir das Dokument barriere-frei.\nDas heißt:\nWir machen das Dokument so um,\ndass Sie es mit einem Vorlese-Programm lesen können.\nEin Vorlese-Programm ist ein Computer-Programm.\nDas Programm liest Ihnen den Text vor.\nSie können uns sagen,\nwenn Sie ein Dokument nicht lesen können.\nDann machen wir das Dokument barriere-frei.\nDas heißt:\nWir machen das Dokument so um,\ndass Sie es mit einem Vorlese-Programm lesen können.\nEin Vorlese-Programm ist ein Computer-Programm.\nDas Programm liest Ihnen den Text vor.\nSie können uns sagen,\nwenn Sie ein Dokument nicht lesen können.\nDann machen wir das Dokument barriere-frei.\nDas heißt:\nWir machen das Dokument so um,\ndass Sie es mit einem Vorlese-Programm lesen können.\nEin Vorlese-Programm ist ein Computer-Programm.\nDas Programm liest Ihnen den Text vor.\nSie können uns sagen,\nwenn Sie ein Dokument nicht lesen können.\nDann machen wir das Dokument barriere-frei.\nDas heißt:\nWir machen das Dokument so um,\ndass Sie es mit einem Vorlese-Programm lesen können.\nEin Vorlese-Programm ist ein Computer-Programm.\nDas Programm liest Ihnen den Text vor.\nSie können uns sagen,\nwenn Sie ein Dokument nicht lesen können.\nDann machen wir das Dokument barriere-frei.\nDas heißt:\nWir machen das Dokument so um,\ndass Sie es mit einem Vorlese-Programm lesen können.\nEin Vorlese-Programm ist ein Computer-Programm.\nDas Programm liest Ihnen den Text vor.\nSie können uns sagen,\nwenn Sie ein Dokument nicht lesen können.\nDann machen wir das Dokument barriere-frei.\nDas heißt:\nWir machen das Dokument so um,\ndass Sie es mit einem Vorlese-Programm lesen können.\nEin Vorlese-Programm ist ein Computer-Programm.\nDas Programm liest Ihnen den Text vor.\nSie können uns sagen,\nwenn Sie ein Dokument nicht lesen können.\nDann machen wir das Dokument barriere-frei.\nDas heißt:\nWir machen das Dokument so um,\ndass Sie es mit einem Vorlese-Programm lesen können.\nEin Vorlese-Programm ist ein Computer-Programm.\nDas Programm liest Ihnen den Text vor.\nSie können uns sagen,\nwenn Sie ein Dokument nicht lesen können.\nDann machen wir das Dokument barriere-frei.\nDas heißt:\nWir machen das Dokument so um,\ndass Sie es mit einem Vorlese-Programm lesen können.\nEin Vorlese-Programm ist ein Computer-Programm.\nDas Programm liest Ihnen den Text vor.\nSie können uns sagen,\nwenn Sie ein Dokument nicht lesen können.\nDann machen wir das Dokument barriere-frei.\nDas heißt:\nWir machen das Dokument so um,\ndass Sie es mit einem Vorlese-Programm lesen können.\nEin Vorlese-Programm ist ein Computer-Programm.\nDas Programm liest Ihnen den Text vor.\nSie können uns sagen,\nwenn Sie ein Dokument nicht lesen können.\nDann machen wir das Dokument barriere-frei.\nDas heißt:\nWir machen das Dokument so um,\ndass Sie es mit einem Vorlese-Programm lesen können.\nEin Vorlese-Programm ist ein Computer-Programm.\nDas Programm liest Ihnen den Text vor.\nSie können uns sagen,\nwenn Sie ein Dokument nicht lesen können.\nDann machen wir das Dokument barriere-frei.\nDas heißt:\nWir machen das Dokument so um,\ndass Sie es mit einem Vorlese-Programm lesen können.\nEin Vorlese-Programm ist ein Computer-Programm.\nDas Programm liest Ihnen den Text vor.\nSie können uns sagen,\nwenn Sie ein Dokument nicht lesen können.\nDann machen wir das Dokument barriere-frei.\nDas heißt:\nWir machen das Dokument so um,\ndass Sie es mit einem Vorlese-Programm lesen können.\nEin Vorlese-Programm ist ein Computer-Programm.\nDas Programm liest Ihnen den Text vor.\nSie können uns sagen,\nwenn Sie ein Dokument nicht lesen können.\nDann machen wir das Dokument barriere-frei.\nDas heißt:\nWir machen das Dokument so um,\ndass Sie es mit einem Vorlese-Programm lesen können.\nEin Vorlese-Programm ist ein Computer-Programm.\nDas Programm liest Ihnen den Text vor.\nSie können uns sagen,\nwenn Sie ein Dokument nicht lesen können.\nDann machen wir das Dokument barriere-frei.\nDas heißt:\nWir machen das Dokument so um,\ndass Sie es mit einem Vorlese-Programm lesen können.\nEin Vorlese-Programm ist ein Computer-Programm.\nDas Programm liest Ihnen den Text vor.\nSie können uns sagen,\nwenn Sie ein Dokument nicht lesen können.\nDann machen wir das Dokument barriere-frei.\nDas heißt:\nWir machen das Dokument so um,\ndass Sie es mit einem Vorlese-Programm lesen können.\nEin Vorlese-Programm ist ein Computer-Programm.\nDas Programm liest Ihnen den Text vor.\nSie können uns sagen,\nwenn Sie ein Dokument nicht lesen können.\nDann machen wir das Dokument barriere-frei.\nDas heißt:\nWir machen das Dokument so um,\ndass Sie es mit einem Vorlese-Programm lesen können.\nEin Vorlese-Programm ist ein Computer-Programm.\nDas Programm liest Ihnen den Text vor.\nSie können uns sagen,\nwenn Sie ein Dokument nicht lesen können.\nDann machen wir das Dokument barriere-frei.\nDas heißt:\nWir machen das Dokument so um,\ndass Sie es mit einem Vorlese-Programm lesen können.\nEin Vorlese-Programm ist ein Computer-Programm.\nDas Programm liest Ihnen den Text vor.\nSie können uns sagen,\nwenn Sie ein Dokument nicht lesen können.\nDann machen wir das Dokument barriere-frei.\nDas heißt:\nWir machen das Dokument so um,\ndass Sie es mit einem Vorlese-Programm lesen können.\nEin Vorlese-Programm ist ein Computer-Programm.\nDas Programm liest Ihnen den Text vor.\nSie können uns sagen,\nwenn Sie ein Dokument nicht lesen können.\nDann machen wir das Dokument barriere-frei.\nDas heißt:\nWir machen das Dokument so um,\ndass Sie es mit einem Vorlese-Programm lesen können.\nEin Vorlese-Programm ist ein Computer-Programm.\nDas Programm liest Ihnen den Text vor.\nSie können uns sagen,\nwenn Sie ein Dokument nicht lesen können.\nDann machen wir das Dokument barriere-frei.\nDas heißt:\nWir machen das Dokument so um,\ndass Sie es mit einem Vorlese-Programm lesen können.\nEin Vorlese-Programm ist ein Computer-Programm.\nDas Programm liest Ihnen den Text vor.\nSie können uns sagen,\nwenn Sie ein Dokument nicht lesen können.\nDann machen wir das Dokument barriere-frei.\nDas heißt:\nWir machen das Dokument so um,\ndass Sie es mit einem Vorlese-Programm lesen können.\nEin Vorlese-Programm ist ein Computer-Programm.\nDas Programm liest Ihnen den Text vor.\nSie können uns sagen,\nwenn Sie ein Dokument nicht lesen können.\nDann machen wir das Dokument barriere-frei.\nDas heißt:\nWir machen das Dokument so um,\ndass Sie es mit einem Vorlese-Programm lesen können.\nEin Vorlese-Programm ist ein Computer-Programm.\nDas Programm liest Ihnen den Text vor.\nSie können uns sagen,\nwenn Sie ein Dokument nicht lesen können.\nDann machen wir das Dokument barriere-frei.\nDas heißt:\nWir machen das Dokument so um,\ndass Sie es mit einem Vorlese-Programm lesen können.\nEin Vorlese-Programm ist ein Computer-Programm.\nDas Programm liest Ihnen den Text vor.\nSie können uns sagen,\nwenn Sie ein Dokument nicht lesen können.\nDann machen wir das Dokument barriere-frei.\nDas heißt:\nWir machen das Dokument so um,\ndass Sie es mit einem Vorlese-Programm lesen können.\nEin Vorlese-Programm ist ein Computer-Programm.\nDas Programm liest Ihnen den Text vor.\nSie können uns sagen,\nwenn Sie ein Dokument nicht lesen können.\nDann machen wir das Dokument barriere-frei.\nDas heißt:\nWir machen das Dokument so um,\ndass Sie es mit einem Vorlese-Programm lesen können.\nEin Vorlese-Programm ist ein Computer-Programm.\nDas Programm liest Ihnen den Text vor.\nSie können uns sagen,\nwenn Sie ein Dokument nicht lesen können.\nDann machen wir das Dokument barriere-frei.\nDas heißt:\nWir machen das Dokument so um,\ndass Sie es mit einem Vorlese-Programm lesen können.\nEin Vorlese-Programm ist ein Computer-Programm.\nDas Programm liest Ihnen den Text vor.\nSie können uns sagen,\nwenn Sie ein Dokument nicht lesen können.\nDann machen wir das Dokument barriere-frei.\nDas heißt:\nWir machen das Dokument so um,\ndass Sie es mit einem Vorlese-Programm lesen können.\nEin Vorlese-Programm ist ein Computer-Programm.\nDas Programm liest Ihnen den Text vor.\nSie können uns sagen,\nwenn Sie ein Dokument nicht lesen können.\nDann machen wir das Dokument barriere-frei.\nDas heißt:\nWir machen das Dokument so um,\ndass Sie es mit einem Vorlese-Programm lesen können.\nEin Vorlese-Programm ist ein Computer-Programm.\nDas Programm liest Ihnen den Text vor.\nSie können uns sagen,\nwenn Sie ein Dokument nicht lesen können.\nDann machen wir das Dokument barriere-frei.\nDas heißt:\nWir machen das Dokument so um,\ndass Sie es mit einem Vorlese-Programm lesen können.\nEin Vorlese-Programm ist ein Computer-Programm.\nDas Programm liest Ihnen den Text vor.\nSie können uns sagen,\nwenn Sie ein Dokument nicht lesen können.\nDann machen wir das Dokument barriere-frei.\nDas heißt:\nWir machen das Dokument so um,\ndass Sie es mit einem Vorlese-Programm lesen können.\nEin Vorlese-Programm ist ein Computer-Programm.\nDas Programm liest Ihnen den Text vor.\nSie können uns sagen,\nwenn Sie ein Dokument nicht lesen können.\nDann machen wir das Dokument barriere-frei.\nDas heißt:\nWir machen das Dokument so um,\ndass Sie es mit einem Vorlese-Programm lesen können.\nEin Vorlese-Programm ist ein Computer-Programm.\nDas Programm liest Ihnen den Text vor.\nSie können uns sagen,\nwenn Sie ein Dokument nicht lesen können.\nDann machen wir das Dokument barriere-frei.\nDas heißt:\nWir machen das Dokument so um,\ndass Sie es mit einem Vorlese-Programm lesen können.\nEin Vorlese-Programm ist ein Computer-Programm.\nDas Programm liest Ihnen den Text vor.\nSie können uns sagen,\nwenn Sie ein Dokument nicht lesen können.\nDann machen wir das Dokument barriere-frei.\nDas heißt:\nWir machen das Dokument so um,\ndass Sie es mit einem Vorlese-Programm lesen können.\nEin Vorlese-Programm ist ein Computer-Programm.\nDas Programm liest Ihnen den Text vor.\nSie können uns sagen,\nwenn Sie ein Dokument nicht lesen können.\nDann machen wir das Dokument barriere-frei.\nDas heißt:\nWir machen das Dokument so um,\ndass Sie es mit einem Vorlese-Programm lesen können.\nEin Vorlese-Programm ist ein Computer-Programm.\nDas Programm liest Ihnen den Text vor.\nSie können uns sagen,\nwenn Sie ein Dokument nicht lesen können.\nDann machen wir das Dokument barriere-frei.\nDas heißt:\nWir machen das Dokument so um,\ndass Sie es mit einem Vorlese-Programm lesen können.\nEin Vorlese-Programm ist ein Computer-Programm.\nDas Programm liest Ihnen den Text vor.\nSie können uns sagen,\nwenn Sie ein Dokument nicht lesen können.\nDann machen wir das Dokument barriere-frei.\nDas heißt:\nWir machen das Dokument so um,\ndass Sie es mit einem Vorlese-Programm lesen können.\nEin Vorlese-Programm ist ein Computer-Programm.\nDas Programm liest Ihnen den Text vor.\nSie können uns sagen,\nwenn Sie ein Dokument nicht lesen können.\nDann machen wir das Dokument barriere-frei.\nDas heißt:\nWir machen das Dokument so um,\ndass Sie es mit einem Vorlese-Programm lesen können.\nEin Vorlese-Programm ist ein Computer-Programm.\nDas Programm liest Ihnen den Text vor.\nSie können uns sagen,\nwenn Sie ein Dokument nicht lesen können.\nDann machen wir das Dokument barriere-frei.\nDas heißt:\nWir machen das Dokument so um,\ndass Sie es mit einem Vorlese-Programm lesen können.\nEin Vorlese-Programm ist ein Computer-Programm.\nDas Programm liest Ihnen den Text vor.\nSie können uns sagen,\nwenn Sie ein Dokument nicht lesen können.\nDann machen wir das Dokument barriere-frei.\nDas heißt:\n
